insight_type,finding,opportunity,priority
CTA Strategy,"Most common CTAs: Contact, View Details, SUBSCRIBE, SHOP, CONTACT",Test these proven CTAs in your ads and landing pages,High
Trust Building,"Common trust signals: Customer Reviews, Experience Claims, Guarantees",Implement these trust elements on your landing pages,High
Technology Stack,"Competitors using: Google Analytics, Shopify, Facebook Pixel",Consider implementing these tracking/marketing tools,Medium
Content Strategy,"Popular content themes: your, balloon, event, pretty, packages",Create content around these themes for better keyword targeting,Medium
PPC Readiness,Average competitor PPC readiness: 8.3/10,Score above 8.3 to outperform competitors in PPC,High
